{
  "id": "azure.aks_secure_baseline.product",
  "name": "AZURE AKS_SECURE_BASELINE",
  "cloud": "azure",
  "version": "1.0.0",
  "owner": "platform-team",
  "description": "Secure baseline product definition generated from validated modules.",
  "inputs": {
    "region": "us-east-1",
    "name": "baseline"
  },
  "outputs": {
    "notes": "Outputs will be emitted from Terraform apply."
  },
  "policies": [
    {
      "id": "labels",
      "type": "k8s_gatekeeper",
      "path": "policies/kubernetes/gatekeeper/constraints/required-labels.yaml",
      "severity": "high"
    }
  ],
  "evidence": []
}